0.51 Carat (ctw)Lab Grown Diamond Snowflake Pendant in 14k Gold White	shopify_CA_8773210800422_49209424740646	1335.00 CAD		in stock	Online	CA	en	https://cdn.shopify.com/s/files/1/0830/7313/8982/files/1400-1029.jpg?v=1768522901,https://cdn.shopify.com/s/files/1/0830/7313/8982/files/1400-0029.jpg?v=1768522911,https://cdn.shopify.com/s/files/1/0830/7313/8982/files/1400-0029_side.jpg?v=1768522911,https://cdn.shopify.com/s/files/1/0830/7313/8982/files/1400-1029side.jpg?v=1768522914	0	Doctor Diamond Jewelry		mothers-day-2026	"Celebrate love, celebrate with a snowflake pendant necklace in 14k white or yellow gold. this elegant  Lab Grown diamond pendant 12 mm in diameter. features 0.52 (ctw) of brilliant white diamond and comes with 16″ chain This snowflake diamond pendant slides freely on its accompanying gold necklace chain and represents well our Canadian winters. Perks 30 Day money back: hassle-free returns. Free Secure, insured shipping with FEDEX or CANADA POST. Tracking number will be sent by email when your order is shipped. Lifetime manufacturer defect warranty included."	apparel & accessories > jewelry > charms & pendants	https://cdn.shopify.com/s/files/1/0830/7313/8982/files/1400-0029_face.jpg?v=1768522898	shopify_CA_8773210800422	https://globaldiamondmontreal.com/products/diamond-snowflake-pendant-0-51-ctw-in-14k-gold?variant=49209424740646&country=CA&currency=CAD&utm_medium=product_sync&utm_source=google&utm_content=sag_organic&utm_campaign=sag_organic	gid://shopify/ProductVariant/49209424740646	third party shopify:third party syncing	gold color:White:Variant	Diamond Pendant		9	3.4 kg	1400-0029	
1.06 Carat (ctw) Christmas Tree Diamond Pendant on a 14k Gold Chain	shopify_CA_8773123277094_46951669465382	2400.00 CAD	1800.00 CAD	in stock	Online	CA	en	https://cdn.shopify.com/s/files/1/0830/7313/8982/files/1400-0032-side-scaled-600x600.jpg?v=1768522849	0	Doctor Diamond Jewelry		mothers-day-2201	"One-of-a-kind lab-grown diamond Christmas tree pendant. Delicate 16 inch 14K gold chain included. Perks 30 Day money back: hassle free returns. Free Secure, insured shipping with FEDEX or CANADA POST. Tracking number will be sent by email when your order is shipped. Lifetime manufacturer defect warranty included."		https://cdn.shopify.com/s/files/1/0830/7313/8982/files/1400-0032chhristmastree.jpg?v=1768522848		https://globaldiamondmontreal.com/products/christmas-tree-diamond-pendant-1-06-ctw-with-14k-gold-chain?variant=46951669465382&country=CA&currency=CAD&utm_medium=product_sync&utm_source=google&utm_content=sag_organic&utm_campaign=sag_organic	gid://shopify/ProductVariant/46951669465382	third party shopify:third party syncing		Diamond Pendant		10	2.9 g	1400-0032	
Infinity heart pendant 10k white gold and diamond Yellow Gold	shopify_CA_8984373231910_47657200746790	805.00 CAD		in stock	Online	CA	en	https://cdn.shopify.com/s/files/1/0830/7313/8982/files/IMG_0086-1024x683_jpg.webp?v=1768525870,https://cdn.shopify.com/s/files/1/0830/7313/8982/files/1400-1019face.jpg?v=1768525877,https://cdn.shopify.com/s/files/1/0830/7313/8982/files/1400-1019side.jpg?v=1768525884	0	Doctor Diamond Jewelry	Yellow Gold	mothers-day-2118			https://cdn.shopify.com/s/files/1/0830/7313/8982/files/1400-0019face.jpg?v=1768525870	shopify_CA_8984373231910	https://globaldiamondmontreal.com/products/infinity-heart-pendant-10k-white-gold-and-diamond?variant=47657200746790&country=CA&currency=CAD&utm_medium=product_sync&utm_source=google&utm_content=sag_organic&utm_campaign=sag_organic	gid://shopify/ProductVariant/47657200746790	third party shopify:third party syncing	color:Yellow Gold:Variant	Diamond Pendant		10	3.2 kg	1400-0019	
Breathtaking diamond pendant in 14k white gold	shopify_CA_8985081708838_47659376279846	1890.00 CAD	1600.00 CAD	in stock	Online	CA	en	https://cdn.shopify.com/s/files/1/0830/7313/8982/files/E8A5387-1024x1024_jpg.webp?v=1768526122,https://cdn.shopify.com/s/files/1/0830/7313/8982/files/E8A5373-1024x1024_jpg.webp?v=1768526124,https://cdn.shopify.com/s/files/1/0830/7313/8982/files/E8A1771-scaled_jpg.webp?v=1768526126,https://cdn.shopify.com/s/files/1/0830/7313/8982/files/E8A1776-scaled_jpg.webp?v=1768526127	0	Doctor Diamond Jewelry	White Gold	mothers-day-2108	"Crafted from 14k gold, this oval-shaped halo diamond pendant has a very timeless allure. The ultra-modern style diamond design of this product for fashionistas or brides offers a comfortable and perfect prettiness element. In fact, the creative part is its royal diamond design elegantly adorning the base of white gold. Adding to that, the pendant features an astonishing fashion sense. *16-inch chain included* Metal Type 14K Gold Metal Color White Main Stone Color White Item Weight 3.8 Grams Total Carat Weight 0.33 Stone Type Diamond Stone Shape Round Stone Color G-H Stone Clarity SI Other Specs Chain Included"		https://cdn.shopify.com/s/files/1/0830/7313/8982/files/1400-7026-1024x1024_jpg.webp?v=1768526121		https://globaldiamondmontreal.com/products/breathtaking-diamond-pendant-in-14k-white-gold?variant=47659376279846&country=CA&currency=CAD&utm_medium=product_sync&utm_source=google&utm_content=sag_organic&utm_campaign=sag_organic	gid://shopify/ProductVariant/47659376279846	third party shopify:third party syncing	color:White Gold:Variant,diamond type:Lab-grown Diamond:Variant	Diamond Pendant		10	0 kg	1400-7026	
Lab grown diamond stud earrings total 1.00 carat VS1 D Color 14k gold White Gold	shopify_CA_10279931609382_51562498556198	1600.00 CAD	1300.00 CAD	in stock	Online	CA	en	https://cdn.shopify.com/s/files/1/0830/7313/8982/files/ChatGPTImageApr3_2025_02_50_04PM_9a11bddf-2e29-429f-866f-41d766d41bd8.png?v=1776114715,https://cdn.shopify.com/s/files/1/0830/7313/8982/files/1100-0000-scaled-1024x1024_eb2fc66c-47f5-450d-a44f-7ba6f4a265aa.jpg?v=1776115264	17	Doctor Diamond Jewelry		mothers-day-2026	"The vivid D-white colour of these earrings will help you present yourself effectively. Make every single moment memorable with these gorgeous diamond-design earrings. Accessorize in style with these gold diamond earrings, which have a high-quality shine to optimize your look. Metal Type 14K Gold Metal Color White Item Weight 2.3 Total Carat Weight 1.00 CT Stone Type Lab-grown diamonds Stone Shape Round Stone Cut Excellent Stone Color D Stone Clarity VS1 Diamond Diameter Approximately 5 MM Each 1100-0051"	apparel & accessories > jewelry > rings	https://cdn.shopify.com/s/files/1/0830/7313/8982/files/Lab_grown_diamond_stud_earrings_total_1.00_carat_VS1_D_Color_14k_gold.png?v=1776114550	shopify_CA_10279931609382	https://globaldiamondmontreal.com/products/lab-grown-diamond-stud-earrings-total-1-10-carat-vs1-d-color-14k-gold-copy?variant=51562498556198&country=CA&currency=CAD&utm_medium=product_sync&utm_source=google&utm_content=sag_organic&utm_campaign=sag_organic	gid://shopify/ProductVariant/51562498556198	third party shopify:third party syncing	choose color:White Gold:Variant	Diamond Studs	true	4	0 kg	1100-0052	
Infinity heart pendant 10k white gold and diamond White Gold	shopify_CA_8984373231910_47657200714022	805.00 CAD		in stock	Online	CA	en	https://cdn.shopify.com/s/files/1/0830/7313/8982/files/IMG_0086-1024x683_jpg.webp?v=1768525870,https://cdn.shopify.com/s/files/1/0830/7313/8982/files/1400-1019face.jpg?v=1768525877,https://cdn.shopify.com/s/files/1/0830/7313/8982/files/1400-1019side.jpg?v=1768525884	0	Doctor Diamond Jewelry	White Gold	mothers-day-2118			https://cdn.shopify.com/s/files/1/0830/7313/8982/files/1400-0019face.jpg?v=1768525870	shopify_CA_8984373231910	https://globaldiamondmontreal.com/products/infinity-heart-pendant-10k-white-gold-and-diamond?variant=47657200714022&country=CA&currency=CAD&utm_medium=product_sync&utm_source=google&utm_content=sag_organic&utm_campaign=sag_organic	gid://shopify/ProductVariant/47657200714022	third party shopify:third party syncing	color:White Gold:Variant	Diamond Pendant		10	3.2 kg	1400-0019	
Lab grown diamond stud earrings total 2.01 carat VS1 D Color IGI 14k gold Yellow	shopify_CA_9919651283238_49744093380902	2400.00 CAD	2100.00 CAD	in stock	Online	CA	en	https://cdn.shopify.com/s/files/1/0830/7313/8982/files/Bigstudlifestyle_a40032bb-bd35-44eb-85d7-57bd3a5f6e19.png?v=1776115145,https://cdn.shopify.com/s/files/1/0830/7313/8982/files/1100-0000-scaled-1024x1024_eb2fc66c-47f5-450d-a44f-7ba6f4a265aa.jpg?v=1776115264	12	Doctor Diamond Jewelry	Yellow	mothers-day-2068	"The vivid D-white colour of these earrings will help you present yourself effectively. Make every single moment memorable with these gorgeous diamond-design earrings. Accessorize in style with these gold diamond earrings, which have a high-quality shine to optimize your look. Metal Type 14K Gold Metal Color White Item Weight 2.3 Total Carat Weight 2.01 CT Stone Type Lab-grown diamonds Stone Shape Round Stone Cut Excellent Stone Color D Stone Clarity VS1 Diamond Diameter Approximately 6.5 MM Each"	apparel & accessories > jewelry > rings	https://cdn.shopify.com/s/files/1/0830/7313/8982/files/Lab_grown_diamond_stud_earrings_total_2.01_carat_VS1_D_Color_IGI_14k_gold.png?v=1776115114	shopify_CA_9919651283238	https://globaldiamondmontreal.com/products/lab-grown-diamond-stud-earrings-4-01ctw-vs1-d-color-14k-gold-copy?variant=49744093380902&country=CA&currency=CAD&utm_medium=product_sync&utm_source=google&utm_content=sag_organic&utm_campaign=sag_organic	gid://shopify/ProductVariant/49744093380902	third party shopify:third party syncing	color:Yellow:Variant	Diamond Studs	true	2	0 kg	1100-0029	
Studs earrings lab-grown diamonds total 0.50 carat VS F screw back 14k gold White Gold	shopify_CA_9978947862822_49979146371366	900.00 CAD	700.00 CAD	in stock	Online	CA	en	https://cdn.shopify.com/s/files/1/0830/7313/8982/files/ChatGPTImageApr3_2025_11_14_51AM_4bb38dab-f82d-4504-b719-99b529bdb422.png?v=1776115557,https://cdn.shopify.com/s/files/1/0830/7313/8982/files/1100-2033-side-copy-1024x1024_59f67455-a26d-47e8-b2e0-5624e7837fea.jpg?v=1776115557,https://cdn.shopify.com/s/files/1/0830/7313/8982/files/1100-2033-face-copy-Copy-1024x1024_ef385be1-4ee8-4ff6-9e33-4fd27378ccaf.jpg?v=1776115557	1	Doctor Diamond Jewelry		mothers-day-2053	"Your earrings are the first to play the main role in lending a sparkling look to your cool style attire. These impressive white gold studs will make you look alluring. Made from bona fide diamonds, these earrings will add a pop of grace to your look and keep you comfortable throughout. This adornment comes in a gorgeous diamond design that lends prettiness to your wardrobe. At Global Diamond Montreal, we make it glitter and shine every time for your happiness. Metal Type 14K Gold Metal Color White Main Stone Color White Item Weight 0.8 Total Carat Weight 0.50 ct Stone Type Lab-grown diamond Stone Shape Round Stone Cut Very Good Stone Color F Stone Clarity VS Diamond Diameter Approximately 4 MM Each"	apparel & accessories > jewelry > rings	https://cdn.shopify.com/s/files/1/0830/7313/8982/files/Studs_earrings_lab-grown_diamonds_total_0.50_carat_VS_F_screw_back_14k_gold_13d675fc-30ea-41fb-84bf-ce061f4b6380.png?v=1776115557	shopify_CA_9978947862822	https://globaldiamondmontreal.com/products/studs-earrings-15-15-pts-lab-grown-diamonds-vs-f-screw-back-14k-white-gold-copy?variant=49979146371366&country=CA&currency=CAD&utm_medium=product_sync&utm_source=google&utm_content=sag_organic&utm_campaign=sag_organic	gid://shopify/ProductVariant/49979146371366	third party shopify:third party syncing	choose color:White Gold:Variant	Diamond Studs	true	4	0 kg	1100-0025	
0.52 Carat (ctw) Diamond Circle of Life Pendant in 14k White Gold	shopify_CA_8773182587174_46951814660390	1480.00 CAD		in stock	Online	CA	en	https://cdn.shopify.com/s/files/1/0830/7313/8982/files/Diamond-jewelry-global-diamond-montreal-37-600x600.jpg?v=1768522878,https://cdn.shopify.com/s/files/1/0830/7313/8982/files/Diamond-jewelry-global-diamond-montreal-29-600x600.jpg?v=1768522879,https://cdn.shopify.com/s/files/1/0830/7313/8982/files/Diamond-jewelry-global-diamond-montreal-36-600x600.jpg?v=1768522880,https://cdn.shopify.com/s/files/1/0830/7313/8982/files/Diamond-jewelry-global-diamond-montreal-38-600x600.jpg?v=1768522881,https://cdn.shopify.com/s/files/1/0830/7313/8982/files/Diamond-jewelry-global-diamond-montreal-33-600x600.jpg?v=1768522882	1	Doctor Diamond Jewelry		mothers-day-2178	"Celebrate love, celebrate life with this diamond circle pendant necklace. Also known as the diamond “Circle of Life,” this elegant pendant 20 mm in diameter. features 0.52 (ctw) of brilliant white diamond accents, prong-set in durable 14K white gold. This classic diamond circle pendant slides freely on its accompanying gold necklace chai Perks 30 Day money back: hassle free returns. Free Secure, insured shipping with FEDEX or CANADA POST. Tracking number will be sent by email when your order is shipped. Lifetime manufacturer defect warranty included."		https://cdn.shopify.com/s/files/1/0830/7313/8982/files/1400-0016.jpg?v=1768522877		https://globaldiamondmontreal.com/products/diamond-circle-of-life-pendant-0-52-ctw-14k-white-gold?variant=46951814660390&country=CA&currency=CAD&utm_medium=product_sync&utm_source=google&utm_content=sag_organic&utm_campaign=sag_organic	gid://shopify/ProductVariant/46951814660390	third party shopify:third party syncing		Diamond Pendant		1	0 kg	1400-0028	
0.45 Carat (ctw) Gracious Diamond Halo Pendant in 14k White Gold	shopify_CA_8773171151142_46951788380454	1800.00 CAD	1400.00 CAD	in stock	Online	CA	en	https://cdn.shopify.com/s/files/1/0830/7313/8982/files/E8A4976-600x600.jpg?v=1768522866,https://cdn.shopify.com/s/files/1/0830/7313/8982/files/E8A4978-600x600.jpg?v=1768522867	0	Doctor Diamond Jewelry		mothers-day-2026	"Love flaunting in casual events with a diamond pendant? Worked of white gold, this top style diamond pendant is an excellent way to lend a sparkling look to your ultra-modern style attire. This high-fashion fine jewelry will enhance your beauty on casual occasions. Perks 30 Day money back: hassle-free returns. Free Secure, insured shipping with FEDEX or CANADA POST. A tracking number will be sent by email when your order is shipped. Lifetime manufacturer defect warranty included."	apparel & accessories > jewelry	https://cdn.shopify.com/s/files/1/0830/7313/8982/files/1400-0025-scaled-600x600.jpg?v=1768522865		https://globaldiamondmontreal.com/products/gracious-diamond-halo-pendant-0-45-ctw-in-14k-white-gold?variant=46951788380454&country=CA&currency=CAD&utm_medium=product_sync&utm_source=google&utm_content=sag_organic&utm_campaign=sag_organic	gid://shopify/ProductVariant/46951788380454	third party shopify:third party syncing		Diamond Pendant		2	0 kg	1400-0025	
Diamond stud earrings total 1.10 carat in 14k gold Yellow Gold	shopify_CA_10197776924966_51724352061734	1200.00 CAD	1080.00 CAD	in stock	Online	CA	en	https://cdn.shopify.com/s/files/1/0830/7313/8982/files/1100-0000-scaled-1024x1024.jpg?v=1776115382,https://cdn.shopify.com/s/files/1/0830/7313/8982/files/ChatGPTImageApr3_2025_11_14_51AM_5cc217ca-13f0-45ab-8522-4d7dd4424200.png?v=1776115382	23	Doctor Diamond Jewelry		mothers-day-2043	"The vivid white colour of these earrings will help you present yourself effectively. Make every single moment memorable with these gorgeous diamond-designed earrings. Accessorize in style with these gold diamond earrings, which come with a high-quality shine to optimize your look. Metal Type 14K Gold Metal Color White Main Stone Color White Item Weight 1.3 Total Carat Weight 1.10 ct Stone Shape Round Diamond Diameter Approximately 5.5 MM Each Stone Color F Stone Clarity VS Diamond Type Lab-grown Diamond"	apparel & accessories > jewelry > rings	https://cdn.shopify.com/s/files/1/0830/7313/8982/files/Diamond_stud_earrings_total_1.10_carat_in_14k_gold.png?v=1776114309	shopify_CA_10197776924966	https://globaldiamondmontreal.com/products/diamond-stud-earrings-1-00-ctw-in-14k-white-gold-copy?variant=51724352061734&country=CA&currency=CAD&utm_medium=product_sync&utm_source=google&utm_content=sag_organic&utm_campaign=sag_organic	gid://shopify/ProductVariant/51724352061734	third party shopify:third party syncing	choose color:Yellow Gold:Variant	Diamond Studs	true	3	0 kg		
Marquise cut diamonds & ruby bracelet (2.2 ctw) in white gold	shopify_CA_8983154852134_49774844707110	2200.00 CAD	2000.00 CAD	in stock	Online	CA	en		0	Doctor Diamond Jewelry		mothers-day-2122	"With its creative marquise cut diamond design, this ranks among the best. Bracelet signifies a lot with its estimable diamond design to your beloved person when they’re gifted. The impressive feature along with ideal quality white gold that provides extreme comfort and allows for active movements. Not to mention that the bracelet is great for casual occasions and comes in an attractive 10k white gold. Metal Type 10K Gold Metal Color White Main Stone Color Red Item Weight 10.2 Grams Stock Ring Size No Total Carat Weight 2.2 Stone Type Diamond, Ruby Stone Shape Marquise / Round Stone Cut Very Good Stone Color Pinkish-Red / G-H Stone Clarity AAA / SI2-I1 Other Specs Additional Information Available Upon Request"	apparel & accessories > jewelry > rings	https://cdn.shopify.com/s/files/1/0830/7313/8982/files/0073-2950_-_ruby_and_diamond_gold_bracelet_-_bracelet_de_diamants_et_rubis_en_or_-_global_diamonds-1.jpg?v=1768525286		https://globaldiamondmontreal.com/products/copy-of-sapphire-diamond-4-70-ctw-tennis-bracelet-in-14k-yellow-gold?variant=49774844707110&country=CA&currency=CAD&utm_medium=product_sync&utm_source=google&utm_content=sag_organic&utm_campaign=sag_organic	gid://shopify/ProductVariant/49774844707110	third party shopify:third party syncing	choose color:White Gold:Variant	Gemstone Bracelets		1	0 kg	1073-2950	
Lab grown diamond stud earrings total 1.40 carat VS1 D Color 14k gold	shopify_CA_10287771320614_51612345925926	1800.00 CAD	1530.00 CAD	in stock	Online	CA	en	https://cdn.shopify.com/s/files/1/0830/7313/8982/files/ChatGPTImageApr3_2025_02_50_04PM.png?v=1776114877,https://cdn.shopify.com/s/files/1/0830/7313/8982/files/1100-0000-scaled-1024x1024_eb2fc66c-47f5-450d-a44f-7ba6f4a265aa.jpg?v=1776115264	31	Doctor Diamond Jewelry		mothers-day-2034	"The vivid D-white colour of these earrings will help you present yourself effectively. Make every single moment memorable with these gorgeous diamond-design earrings. Accessorize in style with these gold diamond earrings, featuring a high-quality shine to enhance your look. Metal Type 14K Gold Metal Color White Item Weight 1.8 Total Carat Weight 1.40 CT Stone Type Lab-grown diamonds Stone Shape Round Stone Cut Excellent Stone Color D Stone Clarity VS1 Diamond Diameter Approximately 5.69 MM Each"	apparel & accessories > jewelry > rings	https://cdn.shopify.com/s/files/1/0830/7313/8982/files/Lab_grown_diamond_stud_earrings_total_1.40_carat_VS1_D_Color_14k_gold.png?v=1776114802		https://globaldiamondmontreal.com/products/lab-grown-diamond-stud-earrings-total-1-50-carat-vs1-d-color-14k-gold-copy?variant=51612345925926&country=CA&currency=CAD&utm_medium=product_sync&utm_source=google&utm_content=sag_organic&utm_campaign=sag_organic	gid://shopify/ProductVariant/51612345925926	third party shopify:third party syncing	choose color:White Gold:Variant	Diamond Studs	true	4	0 kg	1100-0058	
Chic diamond tennis bracelet 1.90 (ctw) in 14k white gold	shopify_CA_8983137354022_47652632396070	4200.00 CAD	3360.00 CAD	in stock	Online	CA	en	https://cdn.shopify.com/s/files/1/0830/7313/8982/files/E8A2050-scaled_b9a7874c-bbf9-46c8-8b1f-2f61e87e7a4a.jpg?v=1768525266,https://cdn.shopify.com/s/files/1/0830/7313/8982/files/E8A1966-scaled.jpg?v=1768525269,https://cdn.shopify.com/s/files/1/0830/7313/8982/files/E8A2052-scaled.jpg?v=1768525272	2	Doctor Diamond Jewelry		mothers-day-2131	"How many of you strive to sports a chic look? Perhaps you can look to this diamond bracelet for the answer. With a top-notch diamond design and fantastic white gold, this tennis bracelet comes out to be one of the breathtakingly beautiful diamond jewelry on the list. Metal Color White Main Stone Color White Item Weight 11.2 Grams Item Length 7"" Total Carat Weight 1.9 Stone Type Natural Diamond Stone Shape Round Stone Cut Very Good Stone Color G-H Stone Clarity SI"	apparel & accessories > jewelry > bracelets	https://cdn.shopify.com/s/files/1/0830/7313/8982/files/braselet-1-1024x645.jpg?v=1768525264		https://globaldiamondmontreal.com/products/chic-diamond-tennis-bracelet-1-90-ctw-in-14k-white-gold?variant=47652632396070&country=CA&currency=CAD&utm_medium=product_sync&utm_source=google&utm_content=sag_organic&utm_campaign=sag_organic	gid://shopify/ProductVariant/47652632396070	third party shopify:third party syncing	choose color:White Gold:Variant	Diamond Bracelets		10	0 kg	1070-0013	
Lab grown diamond stud earrings total 1.10 carat VS1 D Color 14k gold	shopify_CA_9954018689318_49875533300006	1700.00 CAD	1360.00 CAD	in stock	Online	CA	en	https://cdn.shopify.com/s/files/1/0830/7313/8982/files/ChatGPTImageApr3_2025_02_50_04PM_9a11bddf-2e29-429f-866f-41d766d41bd8.png?v=1776114715,https://cdn.shopify.com/s/files/1/0830/7313/8982/files/1100-0000-scaled-1024x1024_eb2fc66c-47f5-450d-a44f-7ba6f4a265aa.jpg?v=1776115264	10	Doctor Diamond Jewelry		mothers-day-2060	"The vivid D-white colour of these earrings will help you present yourself effectively. Make every single moment memorable with these gorgeous diamond-design earrings. Accessorize in style with these gold diamond earrings, which have a high-quality shine to optimize your look. Metal Type 14K Gold Metal Color White Item Weight 2.3 Total Carat Weight 1.10 CT Stone Type Lab-grown diamonds Stone Shape Round Stone Cut Excellent Stone Color D Stone Clarity VS1 Diamond Diameter Approximately 5.5 MM Each 1100-0051"	apparel & accessories > jewelry > rings	https://cdn.shopify.com/s/files/1/0830/7313/8982/files/Lab_grown_diamond_stud_earrings_total_1.10_carat_VS1_D_Color_14k_gold.png?v=1776114715		https://globaldiamondmontreal.com/products/lab-grown-diamond-stud-earrings-2-12-ctw-vs1-d-color-14k-gold-copy?variant=49875533300006&country=CA&currency=CAD&utm_medium=product_sync&utm_source=google&utm_content=sag_organic&utm_campaign=sag_organic	gid://shopify/ProductVariant/49875533300006	third party shopify:third party syncing	choose color:White Gold:Variant	Diamond Studs	true	2	0 kg	1100-0051	
Diamond Cross Pendant 0.90 (Ctw)natural diamond in 10k white Gold	shopify_CA_10199796416806_50857918988582	3500.00 CAD	2750.00 CAD	in stock	Online	CA	en		0	Doctor Diamond Jewelry		mothers-day-2042	"As part of our commitment to offering premium products and a premium shopping experience, we invite you to browse our collection of affordable cross pendants in yellow and white gold, as well as a collection of Greek Key jewelry that features many stylish rings, pendant, bracelets, and earrings — designed to fit any budget. Metal Type 10K Gold Stone Type Natural diamonds Stone Color H Stone Clarity I1 Total Carat Weight 0.90 Item Weight 11.4 GR Chain Length & Style 20"" Rope Perks Free Secure, insured shipping with FEDEX or CANADA POST. Tracking number will be sent by email when your order is shipped. Lifetime manufacturer defect warranty included."		https://cdn.shopify.com/s/files/1/0830/7313/8982/files/1400-0044.png?v=1768528147		https://globaldiamondmontreal.com/products/diamond-cross-pendant-1-02-ctwlab-grown-diamond-in-10k-yellow-gold-copy?variant=50857918988582&country=CA&currency=CAD&utm_medium=product_sync&utm_source=google&utm_content=sag_organic&utm_campaign=sag_organic	gid://shopify/ProductVariant/50857918988582	third party shopify:third party syncing	gold color:White:Variant	Diamond Pendant		1	11.4 g	1400-0044	
Lab-grown Diamond stud earrings total 1.00 carat in 14k gold Yellow Gold	shopify_CA_8985118867750_51556176462118	1200.00 CAD	900.00 CAD	in stock	Online	CA	en	https://cdn.shopify.com/s/files/1/0830/7313/8982/files/ChatGPTImageApr3_2025_11_14_51AM_5cc217ca-13f0-45ab-8522-4d7dd4424200.png?v=1776115382,https://cdn.shopify.com/s/files/1/0830/7313/8982/files/1100-0000-scaled-1024x1024.jpg?v=1776115382	22	Doctor Diamond Jewelry		mothers-day-2102	"The vivid white colour of these earrings will help you present yourself effectively. Make every single moment memorable with these gorgeous diamond-designed earrings. Accessorize in style with these gold diamond earrings, which come with a high-quality shine to optimize your look. Metal Type 14K Gold Metal Color White Main Stone Color White Item Weight 1.3 Total Carat Weight 1.00 ct Stone Shape Round Diamond Diameter Approximately 5 MM Each Stone Color F Stone Clarity VS Diamond Type Lab-grown Diamond"	apparel & accessories > jewelry > rings	https://cdn.shopify.com/s/files/1/0830/7313/8982/files/Lab-grown_Diamond_stud_earrings_total_1.00_carat_in_14k_gold.png?v=1776115382	shopify_CA_8985118867750	https://globaldiamondmontreal.com/products/diamond-stud-earrings-1-00-ctw-in-14k-white-gold?variant=51556176462118&country=CA&currency=CAD&utm_medium=product_sync&utm_source=google&utm_content=sag_organic&utm_campaign=sag_organic	gid://shopify/ProductVariant/51556176462118	third party shopify:third party syncing	choose color:Yellow Gold:Variant	Diamond Studs		7	0 kg		
