Lab-grown Diamond stud earrings total 0.10 CT diamonds in 14k white gold	shopify_CA_8983109632294_47652528455974	390.00 CAD		in stock	Online	CA	en	https://cdn.shopify.com/s/files/1/0830/7313/8982/files/ChatGPTImageFeb12_2026_04_33_24PM.png?v=1776115292,https://cdn.shopify.com/s/files/1/0830/7313/8982/files/Facetune_05-09-2018-16-03-38-2-e1545188133622_d55ec7f4-4165-47d1-9199-ee206b9050aa.jpg?v=1776115292	37	Doctor Diamond Jewelry		mothers-day-2146	"Worked from superb quality white gold material, this stud earring has a scrupulous diamond design that makes it fresh and youthful. The superb design of this stud earring will absolutely make you fall in love with it. Definitely, the white colour stud earring has been inducted into the fashionista’s wardrobe for its knockout style world-class craftsmanship. Metal Type 14K Gold Item Weight 0.6 Diamond weight 0.10 CT Stone Type Lab-Grown Diamond Stone Shape Round Diamond Diameter Approximately 2.25 MM each Stone Color F Stone Clarity VS"	apparel & accessories > jewelry > rings	https://cdn.shopify.com/s/files/1/0830/7313/8982/files/Lab-grown_Diamond_stud_earrings_total_0.10_CT_diamonds_in_14k_white_gold.png?v=1776115292		https://globaldiamondmontreal.com/products/diamond-stud-earrings-5-5-pts-diamonds-si-in-14k-white-gold?variant=47652528455974&country=CA&currency=CAD&utm_medium=product_sync&utm_source=google&utm_content=sag_organic&utm_campaign=sag_organic	gid://shopify/ProductVariant/47652528455974	third party shopify:third party syncing	choose color:White Gold:Variant	Diamond Studs		5	0 kg	1102-0005	
Diamond stud earrings total 1.10 carat in 14k gold White Gold	shopify_CA_10197776924966_50852470882598	1200.00 CAD	1080.00 CAD	in stock	Online	CA	en	https://cdn.shopify.com/s/files/1/0830/7313/8982/files/1100-0000-scaled-1024x1024.jpg?v=1776115382,https://cdn.shopify.com/s/files/1/0830/7313/8982/files/ChatGPTImageApr3_2025_11_14_51AM_5cc217ca-13f0-45ab-8522-4d7dd4424200.png?v=1776115382	47	Doctor Diamond Jewelry		mothers-day-2026	"The vivid white colour of these earrings will help you present yourself effectively. Make every single moment memorable with these gorgeous diamond-designed earrings. Accessorize in style with these gold diamond earrings, which come with a high-quality shine to optimize your look. Metal Type 14K Gold Metal Color White Main Stone Color White Item Weight 1.3 Total Carat Weight 1.10 ct Stone Shape Round Diamond Diameter Approximately 5.5 MM Each Stone Color F Stone Clarity VS Diamond Type Lab-grown Diamond"	apparel & accessories > jewelry > rings	https://cdn.shopify.com/s/files/1/0830/7313/8982/files/Diamond_stud_earrings_total_1.10_carat_in_14k_gold.png?v=1776114309	shopify_CA_10197776924966	https://globaldiamondmontreal.com/products/diamond-stud-earrings-1-00-ctw-in-14k-white-gold-copy?variant=50852470882598&country=CA&currency=CAD&utm_medium=product_sync&utm_source=google&utm_content=sag_organic&utm_campaign=sag_organic	gid://shopify/ProductVariant/50852470882598	third party shopify:third party syncing	choose color:White Gold:Variant	Diamond Studs	true	6	0 kg	1100-0016-1	merge
Lab grown diamond stud earrings total 2.24 carat VS1 D Color IGI 14k gold Yellow	shopify_CA_10459508179238_52754383110438	2600.00 CAD	2400.00 CAD	in stock	Online	CA	en	https://cdn.shopify.com/s/files/1/0830/7313/8982/files/Bigstudlifestyle_a40032bb-bd35-44eb-85d7-57bd3a5f6e19.png?v=1776115145,https://cdn.shopify.com/s/files/1/0830/7313/8982/files/1100-0000-scaled-1024x1024_eb2fc66c-47f5-450d-a44f-7ba6f4a265aa.jpg?v=1776115264	6	Doctor Diamond Jewelry	Yellow	mothers-day-2026	"The vivid D-white colour of these earrings will help you present yourself effectively. Make every single moment memorable with these gorgeous diamond-design earrings. Accessorize in style with these gold diamond earrings, which have a high-quality shine to optimize your look. Metal Type 14K Gold Metal Color White Item Weight 2.3 Total Carat Weight 2.24 CT Stone Type Lab-grown diamonds Stone Shape Round Stone Cut Excellent Stone Color D Stone Clarity VS1 Diamond Diameter Approximately 6.58 mm each"	apparel & accessories > jewelry > rings	https://cdn.shopify.com/s/files/1/0830/7313/8982/files/Lab_grown_diamond_stud_earrings_total_2.24_carat_VS1_D_Color_IGI_14k_gold.png?v=1776115145	shopify_CA_10459508179238	https://globaldiamondmontreal.com/products/lab-grown-diamond-stud-earrings-total-2-58-carat-vs1-d-color-igi-14k-gold-copy?variant=52754383110438&country=CA&currency=CAD&utm_medium=product_sync&utm_source=google&utm_content=sag_organic&utm_campaign=sag_organic	gid://shopify/ProductVariant/52754383110438	third party shopify:third party syncing	color:Yellow:Variant	Diamond Studs	true	4	0 kg	1100-0061	
17′′ 14K white gold 0.36 CT natural diamond necklace	shopify_CA_9926087803174_49764504142118	1800.00 CAD	1600.00 CAD	in stock	Online	CA	en		0	Doctor Diamond Jewelry		mothers-day-2026	"Our stunning 17″ 14K white gold natural diamond necklace enhances your jewelry collection. This necklace showcases a beautiful white and yellow gold combination, exuding a luxurious and versatile appeal. Crafted with meticulous attention to detail, the necklace features a delicate, timeless design that effortlessly complements any outfit. The 17″ length is perfect for layering or wearing alone as a dainty statement piece. Elevate your style with our exquisite 17″ 14K White & Yellow Gold Necklace, a must-have accessory for any jewelry lover. 14k Gold Color Yellow Weight 3.2 Grams Natural Diamond Carat 0.36 ct SI G"	apparel & accessories > jewelry > charms & pendants	https://cdn.shopify.com/s/files/1/0830/7313/8982/files/1500-7003.jpg?v=1768527571		https://globaldiamondmontreal.com/products/17-14k-yellow-gold-natural-diamond-necklace-copy?variant=49764504142118&country=CA&currency=CAD&utm_medium=product_sync&utm_source=google&utm_content=sag_organic&utm_campaign=sag_organic	gid://shopify/ProductVariant/49764504142118	third party shopify:third party syncing		Diamond Pendant		10	0 kg	1500-7003	
Lab grown diamond stud earrings total 2.24 carat VS1 D Color IGI 14k gold White	shopify_CA_10459508179238_52754383143206	2600.00 CAD	2400.00 CAD	in stock	Online	CA	en	https://cdn.shopify.com/s/files/1/0830/7313/8982/files/Bigstudlifestyle_a40032bb-bd35-44eb-85d7-57bd3a5f6e19.png?v=1776115145,https://cdn.shopify.com/s/files/1/0830/7313/8982/files/1100-0000-scaled-1024x1024_eb2fc66c-47f5-450d-a44f-7ba6f4a265aa.jpg?v=1776115264	7	Doctor Diamond Jewelry	White	mothers-day-2026	"The vivid D-white colour of these earrings will help you present yourself effectively. Make every single moment memorable with these gorgeous diamond-design earrings. Accessorize in style with these gold diamond earrings, which have a high-quality shine to optimize your look. Metal Type 14K Gold Metal Color White Item Weight 2.3 Total Carat Weight 2.24 CT Stone Type Lab-grown diamonds Stone Shape Round Stone Cut Excellent Stone Color D Stone Clarity VS1 Diamond Diameter Approximately 6.58 mm each"	apparel & accessories > jewelry > rings	https://cdn.shopify.com/s/files/1/0830/7313/8982/files/Lab_grown_diamond_stud_earrings_total_2.24_carat_VS1_D_Color_IGI_14k_gold.png?v=1776115145	shopify_CA_10459508179238	https://globaldiamondmontreal.com/products/lab-grown-diamond-stud-earrings-total-2-58-carat-vs1-d-color-igi-14k-gold-copy?variant=52754383143206&country=CA&currency=CAD&utm_medium=product_sync&utm_source=google&utm_content=sag_organic&utm_campaign=sag_organic	gid://shopify/ProductVariant/52754383143206	third party shopify:third party syncing	color:White:Variant	Diamond Studs	true	2	0 kg	1100-0061	
1.3 Carat (ctw) Marquise-Cut Diamond and Emerald Bracelet in 14k Gold	shopify_CA_8772991680806_46951350206758	1920.00 CAD		in stock	Online	CA	en	https://cdn.shopify.com/s/files/1/0830/7313/8982/files/SET1070-0008ring1015-0006.jpg?v=1768522739,https://cdn.shopify.com/s/files/1/0830/7313/8982/files/IMG_2904-e1544132671821-683x1024.jpg?v=1768522740,https://cdn.shopify.com/s/files/1/0830/7313/8982/files/IMG_2937-600x400.jpg?v=1768522741	0	Doctor Diamond Jewelry		mothers-day-2203	"Add a touch of color to any outfit, with this spectacular emerald and diamond fashion link bracelet. Featuring 1.30 carats of marquise cut green emeralds, separated by sparkling white diamond accents set in brightly polished 14K gold, this dynamic bracelet will elevate any outfit. Featuring a secure hidden-box clasp, with safety catch, each gemstone in this gold gemstone bracelet was hand-selected and set by a Global Diamond Montreal master jeweller to ensure this piece meets our high finish standards. Perks30 Day money back: hassle free returns.Free Secure, insured shipping with FEDEX or CANADA POST.Tracking number will be sent by email when your order is shipped.Lifetime manufacturer defect warranty included. Metal Type 14K Gold Main Stone Color Green Stone Type Diamond, Emerald Stone Shape Marquise / Round Stone Cut Very Good Stone Color Green / G-H Total Carat Weight 1.6 Stone Clarity AAA / SI2-I1 Item Weight 6.4 Grams"		https://cdn.shopify.com/s/files/1/0830/7313/8982/files/1070-0008.jpg?v=1768522734		https://globaldiamondmontreal.com/products/diamond-emerald-marquise-cut-bracelet-1-3-ctw-in-14k-gold?variant=46951350206758&country=CA&currency=CAD&utm_medium=product_sync&utm_source=google&utm_content=sag_organic&utm_campaign=sag_organic	gid://shopify/ProductVariant/46951350206758	third party shopify:third party syncing		Gemstone Bracelets		10	0 kg	1070-0008	
